{
  "schemaVersion": "1.0",
  "planSlug": "minimal-xor",
  "title": "Minimal accept-or-reject",
  "scenario": "A requester submits a request and a reviewer accepts or rejects it.",
  "actor": "Requester",
  "audience": "layperson",
  "actors": [
    { "id": "U", "label": "Requester", "kind": "actor" },
    { "id": "R", "label": "Reviewer", "kind": "actor" }
  ],
  "graph": {
    "entry": "S1",
    "nodes": {
      "S1": {
        "type": "sequence",
        "processLabel": "Submit request",
        "processWho": "Requester",
        "messages": [
          { "from": "U", "to": "R", "text": "Sends the request", "async": false }
        ],
        "next": "D1"
      },
      "D1": {
        "type": "decision",
        "kind": "xor",
        "processLabel": "Accept?",
        "actor": "R",
        "question": "Accept the request?",
        "branches": [
          {
            "id": "D1.yes",
            "when": "accepts",
            "label": "Accepts",
            "next": "end_ok"
          },
          {
            "id": "D1.no",
            "when": "rejects",
            "label": "Rejects",
            "next": "end_no"
          }
        ]
      },
      "end_ok": {
        "type": "end",
        "processLabel": "Accepted"
      },
      "end_no": {
        "type": "end",
        "processLabel": "Rejected"
      }
    }
  }
}
